,CLEAN_tweets,likes
1129,the bank of punjab is pleased to collaborate with the citizen foundation to sponsor the cycle for change to raise funds for the school restoration damaged during flash floods in pakistan thebankofpunjab harfardkakhayal floodrelief supporteducation https t co itsclbhn o,10
1107,the bank of punjab is pleased to collaborate with the citizen foundation to sponsor the cycle for change to raise funds for the school restoration damaged during flash floods in pakistan thebankofpunjab harfardkakhayal floodrelief supporteducation https t co vjoz vjnpv,0
1387,the biggest issue is the timing of the floods which if not addressed properly the consequences of which have failed to reach us chairman pakistan peoples party and fm https t co lwc pazqmk,57
1102,the catastrophic climate change induced floods in pakistan early this year that resulted in losses and damages of over us billion refocused the global attention towards this critical issue bbzleadingclimatejustice,5
596,the devastating floods in pakistan have impacted the lives of millions of people many face cold winters and risk of disease livelihoods and homes can take months to restore britishasiantrust ambassador calls for more support donate https t co jnkp g bjs https t co lmzbymn,25
861,the devastating pakistanfloods can be the spur for countries to work together accelerate collective climate action acting sooner rather than later is crucial urge authors of a recent blog post sao cop https t co rr ktsxzd,9
814,the eagle flew across the pond we re proud of penny appeal canada on hosting a fantastic event with all in aid of pakistan flood victims you can help support the cause like khabib by clicking the link below https t co eel mqw y https t co ueehudlesb,4
1003,the eu has contributed million to the pakistan space and nuclear programmes utterly risible pakistan alone faces a billion bill for its floods which is spends next to bugger all on,4
1379,the flooding in pakistan was caused by the following explosive population growth from m in same as uk to m today the degradation of the indus delta redirection of indus river for irrigation etc to feed the extra population floods on a flood plain shocked,92
1085,the floods are dreadful but they are not unprecedented the flood killed more pakistan has severe floods pretty much every year https t co iiqjo mjth,3
71,the floods came as a curse because niazi lives when niazi dies all curses will be lifted from pakistan,0
1195,the floods in pakistan have nothing to do with geoengineering,0
796,the floods in pakistan were because of brexit,1
987,the floods is pakistan have been as bad in the past if you look you will find the details however i do not expect you to look as you do not want to see that it was as bad in the past,0
1147,the floods were caused by pakistan chopping down most of its trees they ve had rain before,2
721,the foreign mister said that having experienced first-hand scale and devastation of pakistan floods they traveled to the united nations general assembly to advocate for climate justice bbzleadingclimatejustice,21
908,the foreign mister said that having experienced first-hand scale and devastation of pakistan floods they traveled to the united nations general assembly to advocate for climate justice bbzleadingclimatejustice cop https t co hfr js q,25
931,the foreign mister said that having experienced first-hand scale and devastation of pakistan floods they traveled to the united nations general assembly to advocate for climate justice bbzleadingclimatejustice cop https t co jlmrphwc x,0
785,the foreign mister said that having experienced first-hand scale and devastation of pakistan floods they traveled to the united nations general assembly to advocate for climate justice bbzleadingclimatejustice https t co b uawu bzo,25
722,the foreign mister said that having experienced first-hand scale and devastation of pakistan floods they traveled to the united nations general assembly to advocate for climate justice bbzleadingclimatejustice https t co c yheg mog,21
782,the foreign mister said that having experienced first-hand scale and devastation of pakistan floods they traveled to the united nations general assembly to advocate for climate justice bbzleadingclimatejustice https t co h svre kra,1
786,the foreign mister said that having experienced first-hand scale and devastation of pakistan floods they traveled to the united nations general assembly to advocate for climate justice bbzleadingclimatejustice https t co srhcjnuoxp,6
787,the foreign mister said that having experienced first-hand scale and devastation of pakistan floods they traveled to the united nations general assembly to advocate for climate justice bbzleadingclimatejustice https t co tqyfouyno,4
146,the g was ably led by mister of climate change of pakistan who spoke passionately on behalf of both pakistanis who had suffered devastating floods with losses and damages estimated at usd billion and all the people from vulnerable developing countries https t co oeco uqc l,0
541,the greek mister offered sympathies on the recent devastating floods in pakistan offered continued support for relief rehabilitation efforts thanked greek government its people for their support in flood relief rehabilitation efforts in pakistan https t co v sz bpozx,11
209,the hard-fought lossanddamagefund is integral to climate justice and pakistani negotiators helped achieve it by uniting developing countries at cop months after heavy rains and floods devastated their country s speaks with us https t co t twpd c,25
214,the hard-fought lossanddamagefund is integral to climate justice pakistan negotiators helped achieve it by uniting developing countries at cop months after heavy rains floods devastated their country s spoke with https t co bfcfrj ccc,21
213,the hard-fought lossanddamagefund is integral to climate justice pakistan negotiators helped achieve it by uniting developing countries at cop months after heavy rains floods devastated their country s spoke with https t co nguta jnuh,5
843,the historic floods demonstrate just how much women and the poor have been systematically ignored writes https t co hniaczcgqp,1
330,the historic floods exposed just how much women and the poor have been systematically ignored writes https t co hniacztjsp,3
997,the indian express as cop winds up a look at the worst climate disasters of https t co dp oktdai via,0
496,the internal threats disasters floods locusts and polio faced by the country were dealt with very skillfully pakistan army under the leadership of general bajwa played an important role,1
326,the international rules-based order is fracturing divisions are deepening crises in energy food and agriculture are proliferating the severe floods in pakistan demonstrate the urgent need for action to combat climatechange https t co fdo qykccj climateaction,0
783,the limits of loss and damage a cautionary tale from pakistan https t co cja tt xpz,2
749,the map itself debunks allegation over a third of pakistan in several ways the coloured area is obviously much smaller the area as a number is much smaller of pakistan if floods impacted of population then river valleys are more sparsely populated than deserts,0
606,the odds of pakistan facing a currency crisis in the next months now exceed following floods that killed thousands of people and displaced millions more a bloomberg economics risk model showed,0
600,the pakistanfloods damaged key infrastructure in nushki balochistan today i visited the ongoing recovery work conducted by with the support of nuski district admin to repair and renovate schools and hospitals resilientpakistan https t co zonettvjf,42
448,the political turmoil in pakistan comes as it reels from the economic crisis and the effects of devastating floods https t co aefn cm bp,10
1348,the poorest in pakistan displaced by floods the poorest in island nations who are losing their countries the poorest who die of heat exhaustion or lose their homes in natural disasters,0
398,the projected gap of bn in current annual budget is likely to plunge pakistan deeper into debt crises to compensate the damage created by floods,3
1414,the recent floods in pakistan is a proof climate change impact is real and how it will come after us one after the other pakistan paid the price for the mess rich countries made but sooner or later all will pay,0
1053,the session first swiftly approved the text s provision to set up a loss and damage fund to help developing countries bear the immediate costs of climate-fuelled events such as storms and floods bbzleadingclimatejustice https t co kupvabllt,25
6,the situation is dire without women s participation and leadership we are failing to provide flood-affected women with services writes https t co hniaczc bh,2
454,the situation is dire without women s participation and leadership we are failing to provide flood-affected women with services writes https t co hniaczcgqp,27
140,the time has come for me to repay the favour and increase the blood pressure of afghans i haven t finished my innings i don t respect people who call pashtuns gul khan mock the floods in pakistan and insult punjabis,5
1005,the two thousand or so who died in the floods are no longer here https t co pgaq gjonv,1
1276,the un insisted a demand from the us war on drugs this be destroyed for a couple of years or they would stop giving aid to nearby countries until those massive mud floods in pakistan and india in,2
1048,the whole things a farce banging on about pakistan floods which happen every monsoon people live in a river delta what do people expect to happen,7
1398,the wonderful of shares his experiences of cop this year has been one of the worst because of the floods devastating rains i come here to raise the issue of reparations and put pressure on the decision-makers https t co f xwzpxqkc,8
649,there has always been floods in pakistan but it has been exasperated by removal of of trees which also feed on c to produce oxygen co is at its lowest for years,0
745,there have been floods since the beginning but how this much this vast an area this often or this quick nice try though and i m glad you learned about the history of flooding in pakistan now do the other counties i listed,0
803,there is no climate emergency there has been floods i pakistan in the past due to the monsoon,0
1007,there is no such thing as climate carnage mikey a weather event is not climate a natural disaster is not climate this is not a global crisis floods have happened before even in pakistan does the globe include china india,0
1392,they know a certain amount of money goes to countries that help america no questions asked embassies check word was pakistan gives cents of every dollar to people that america gives now on floods govt is keeping all the money not even giving cents to people,2
755,they seem to lack imagination empathy for others regarding how bad things can get regarding weather disasters which have been amplified by more heat moisture in the atmosphere examples are the extreme floods in germany the recent floods in pakistan now australia https t co qwzxiyakpg,1
1310,they ve never ever had floods in pakistan before climate change have they it s just these floods are different ain t that a thing,0
11,thieves will run away after eating the aid of flood victims floods aid turkey pakistan actualwarinpakistan ptilongmarch https t co davlmy hm,0
1462,this be izzatti only shareef can bring asking money fr the world for floods and london court telling the world how this crime mister stole previous flood funds shameful,2
1427,this evening s game at will raise money for families affected by the floods in pakistan https t co fqkari zpq,2
1428,this evening s game at will raise money for families affected by the floods in pakistan https t co ppyfnxinvc,0
1410,this evening s game at will raise money for families affected by the floods in pakistan https t co pygvhoaa w,0
457,this is alarming more than million children have had their education disrupted in a country that even before the floods had the world s second highest number of out-of-school children https t co vf ocmc kp by,3
1233,this is not the first time floods have destroyed pakistan it received donations from countries and institutions all over the world in the aftermath of the floods but it did not evolve https t co jvjuqnnzmf,0
805,this is seriously an excellent piece ms munshey i am a senior at georgetown university currently writing an article about the floods in pakistan i would love the opportunity to connect with you to learn more about your work my email is cdk edu,2
571,this is the level of prime time show of one of our most senior journalist pakistan politics is all about only either you with him or against him nothing else matters anymore economy in tatters floods mir sb discussing medal amazing sense of responsibility,0
793,this past july million people were impacted by catastrophic floods in pakistan which partook in relief efforts two hpd leaders asst chief cmdr rodriguez traveled to pakistan for a first-hand humanitarian mission with https t co yidirckq n,36
99,this project will provide food for month to flood-affected displacedfamilies financial assistance in building their heavyrains have triggered floods wreaked havoc across much of pakistan leaving dead displaced people homeless https t co pml fdthwl,0
1199,this summer devastating floods in pakistan left communities without key resources and vulnerable read more about it in this piece by here https t co ajmmlbrhqj,0
462,this world cup could have been used to promote bring to the fore critical issues affecting the world the russian ukraine war every other armed conflict in the world the floods in pakistan nigeria and other impacts of climate change globally extreme poverty,30
1126,this worldchildrensday rangers charity foundation donates to to help provide rapid assistance to children and their families affected by the devastating flooding in pakistan full story https t co puqnjtmci image credits sami malik moin https t co fmzmiykefk,9
673,this year s floods are comparable to those of the worst on record when more than people died and nearly a fifth of the country was under water https t co litywmk wu via,0
67,those large death totals from s to s were earthquakes extreme events european heat wave linked to deaths then the floods in pakistan heatwaves in india and china killed thousands more etc etc,11
827,thousands of families are scattered under the heavy waters floods and rest of the worlds cares less,0
154,to address challenges transgender community is facing in floods in pakistan pjn signed mou with hon chairperson rabiya javeri agha for joint action on national program inclusion of transgender community in flood response supported by https t co qhqdp gvcc,11
756,today in balochistan to support the pakistanfloods early recovery work with and our partner together for a resilientpakistan https t co btedgppxcp,38
1171,today on worldchildrensday and every day stands with the children of south asia at pm pakistan time today ayesha from pakistan is taking over my account and raising her voice for children whose lives have been upended by catastrophic floods stay tuned,333
790,tragedies are happing all over the world and we clearly know why are you focusing on only ukraine what about pakistan floods sri lanka crisis big thing is canada is going though shit and you are more worried about ukraine than your own country reminder you re pm,204
1221,tunafish well i think that is a tricky one to start with who pays does china although we import its goods and what about those countries that have ruined their ecosystem like pakistan etc where deforestation causes floods too how do you separate the relative effects,2
53,turn and fly to pakistan for my first mission on the same day why not happy to be here to support the hdpnexus and promote development solutions following the floods proudsurge,6
978,u should watch the united nations conference all pakistani delegates were talking about was kashmir and india and mind u at that time pakistan was having huge floods and get they weren t talking about environmental protection but kashmir and india,0
101,umm hello american institutions are still banning rolling pakistan like the imf and world bank and the us gave tons of aid relief when the floods happened,0
1080,un created g group in this group those countries members who are badly affected by floods and various natural disasters pakistan is also member of this group very soon un will release fund for the restoration of climate change,1
610,un sdg where prevailing can mitigate the climate change effects and protect societies adequately long droughts and heavy floods like in pakistan uganda were predicted and could be mitigated provided the sdg is adapted by policymakers through parliaments https t co becdpxzfj,1
124,under the presidency of mna ali musa gilani ypf coordinator mr shamoon hashmi first session parliamentary cooperation on climate change adaptation in the wake of recent floods in pakistan was facilitated by sara hayat https t co dgrxgcnl,4
1465,undpinpakistan are partnering to support the flood-affected communities in sindh the partnership will create income opportunities for households affected by floods support the construction of community infrastructure resilientpakistan https t co xipviijzhg,76
543,unfccc cop loss and damage into focus pakistan floods makes headlines fiji antigua barbados separate fund transparency an issue india and china big emitters us eu historical responsibility polluter countries fund enigmatic,0
612,unicef has mobilized its most valuable core resources to respond to pakistanfloods and provide children with humanitarian assistance we are grateful to others for providing critical funding to these core resources for results https t co aut f uzd,58
643,valuable report from the on the slow post-flood recovery in pakistan s neglected baluchistan province and a reminder that the news is where the journalists are but not always vice versa https t co cdcrcfhtbh,3
780,very confusing isn t it kelvin doesn t southgate realise he s responsible for gay rights world inequality third world debt floods in pakistan war in ukraine melting polar ice caps u k inflation and the world energy crisis,0
403,very us centric and not a pixel relating to the climate change emergency nothing even on the floods in pakistan poor show in my opinion perhaps next year they could do better with the correct persausion,0
1074,via we couldn t fail them how pakistan s floods spurred fight for climate justice https t co yo gqzbz l,0
47,wanted to spotlight a folk artist who got million hits on his song kana yari then lost his home in the floods and shehzad roy who has done so much for pakistan with his zindagi trust why is wahab bugti s baloch accent instrument considered unofficial its the true pakistan,2
308,was the need to focus on neglected crops really discussed at cop you can read some of the effects of growing the same old crops here https t co o rlpjdrx,3
210,we are setting up this fund to respond to climate impacts not only in the present but also in the future s tells there are many unknowns about the lossanddamagefund but it will help when millions are on the move https t co bfcfrin ou,1
167,we are setting up this fund to respond to climate impacts not only in the present but also in the future s tells there are many unknowns about the lossanddamagefund but it will help when millions are on the move https t co bfcfrj en,1
795,we couldn t fail them how pakistan s floods spurred fight at cop for loss and damage fund https t co pne fwb via,0
1040,we couldn t fail them how pakistan s floods spurred fight at cop for loss and damage fund pakistan pushed for damage funds with other frontline countries dos to https t co e acuex ht,12
1365,we had many warnings about climate change kop suppress ignore serious effects self interest prevails pakistan has lost rd of their land floods and fires rage all around the world in gb unnaturally long hot summers and flooding yet in cop self-interest prevails,1
623,we must do this any fule no that there were never floods in pakistan until al gore invented global warming,1
1254,we need to leave providing hope to hose most impacted by climate change those experiencing floods in pakistan and drought across the horn of africa says,0
1211,we ought to work together to help the victims of the devastating floods in pakistan this is going to go on for a while and we d need to be steadfast united as our team embarks to help the victims i urge for your generous help donate https t co wifs oojxk,1
515,we re proud to be supporting s work in pakistan in the aftermath of the recent severe floods helping children like benazir find out more https t co espdb wjxx https t co r liezhidp,4
42,weak demand for pak exports in its major trade destinations mainly europe and us large trade budget deficit devastating floods which increased the need for further imports and a lot other factors as reasons for high rates in pakistan,0
539,webinar from building resilient rivers and deltas november cet est https t co azbnber dy globalwater cc,1
1256,well hardly seen anyone eat insects in pakistan but african nations have some dishes of them and we are going through crisis and will get out of it and as for floods we stood as a nation and helped eachother didn t use floods to scam others like indians do,0
1263,what about floods victims of pakistan you just want to beg with help of palestine by taking their name in the end you are still a begging from the islamic world have some guts like you are being ruled by americans just like britishers ruled in us,0
354,what climate breakdown the one that hedge funds and leftie media love to lie about https t co sab ogibvk,1
836,what does pakistan s mister for climate change think about global climateaction following her country s devastating floods dw correspondent atif baloch found out when he spoke to her at cop in egypt https t co bqd zhptxa,315
962,what goes on in pakisatn won t stay in pakistan pakistan s floods loss and damage fund discussion at in https t co cds ipmiti,0
942,what happened in pakistan floods was devastating but disaster aid as envisaged should be audited by third party to ensure beneficiaries are genuine,0
1486,what is wrong with you why it matters to you or your party how many people showed up go do something constructive like helping the people effected with floods in pakistan,0
337,what went on in pakistan will not stay in pakistan cop a big win for poorer nations as they are the victims of floods droughts heat waves famines and storms despite having contributed little to the pollution that heats up the globe https t co cxbq tuewv,33
1240,when dar came the dollar was controlled with unfair means imports opened then came the floods the deluge costs us badly on domestic and external side now dollar is going down in the world but its going up in pakistan due to low fx reserves of,1
440,when pakistan was created as an independent nation its population was million and its landscape was forestry its population is now million and its reduced its forestry by two thirds to just and they wonder why it floods gross mismanagement of their country,0
1378,where do millions in pakistan displaced by floods turn to now how can farmers in kenya facing drought feed their families cop must address the climate impacts people can t adapt to loss has a name damage has an address from my op-ed https t co d gu ganqx https t co wv ua xw,20
1293,while the floods in recent weeks have touched much of pakistan the southern sindh province where karachi is the capital has been the most affected https t co bqfoibxcfp via,0
1186,who made that claim https t co grvbfo nr,0
1009,why are you still repeating the false claim that pakistan floods covered a third of the country unosat data shows km of km was affected by floods between aug pakistan is km in total https t co widbot mqt https t co h ebtupdfg,1
638,why can houses not get home insurance after the floods in northern nsw australia where are the insects that used to muck up your car windscreen as a kid why was a third of pakistan flooded under water did u not see the black summer bushfires in eastern australia its real https t co fy uoo,0
1380,why do you think it s big oil that s causing the damage after all if ghg s were solely to blame the pakistan floods which have been a regularly devastation occurrence throughout history is it not the world s people who burn oil gas biomass that create the emissions who,1
902,why is it that people are so ignorant of the past we treat each new weather yes weather disaster as if it s never happened before but inevitably it has pakistan has always had floods and the most recent was around of the land area nowhere near the claimed,0
950,why lie if the data shows a problem that we actually do change the weather why lie oh no it s a downward trend when it comes to floods in pakistan is this also the fault of co from my old saab diesel climatefraud https t co nixmuotsz,1
906,why not have a look back at footage or reports of the previous floods they have had which were a lot worse pakistan floods on a regular basis,0
60,why not pakistan sue us and all european countries in international courts for floods pakistan should default on foreign loans tell them to adjust billion for anti-terrorism and billion for floods caused by global warming,0
235,wildfires floods famine drought heat globally in incl m people in floods over pakistan m people in famine in horn of africa after year drought dustbowl was a human induced disaster but not an almost unstoppable global disaster https t co uporkv lkc,0
