,CLEAN_tweets,likes
487,human appeal has launched plans to build flood-resistant homes in the country read more at https t co hagtxirfng britishasian southasian community culture people uknews news humanappeal pakistan pakistanfloods charity,0
1089,hussein no amount of money can bring back lives lost due to the effects of climate change e g deaths from floods like what we saw in pakistan or heat waves or forest fires or tsunamis due to rising oceans and melting glaciers or famines due to drought desertification,0
493,i am a prophet my answers are great they are not bad like the beautiful flood that just happened in pakistan vaccines and floods for pakistan oh now we know how you got to scotland,0
670,i am feeling so blessed and thanking allah that in pakistan we have an organisation like alkhidmatfoundation the quantum of work and response by alkhidmat during floods and post flood rehabilitation is unforgettable thank you https t co eaesiqd ov,2
1059,i do paying pakistan million due to severe flooding i see no mention the pakistani government allowed of all woodland in north of country to be cut down for profit now run off water in the hills causing floods in the south can t make this shit up uk problem,0
82,i do think about it i think what a waste of emissions on building overpriced bubble investments infrastructure that are not homes useful many care about keeping living planet many think m in floods in pakistan m in famine in horn of africa quite enough and time to stop https t co fhmghuunmk,0
648,i felt it but i think it is unfortunately normal and i hope zelensky and western presidents prepared for this women in afghanistan disappeared women in iran are in the way to disappear pakistan floods are out now it is time for musk be suspicious on why world cup,1
412,i get my info from the scientific consensus on anthropogenic warming reflected in the ipcc reports only confirmed by the extreme weather we are seeing nowadays such as this summer s heatwave here pacific nw heatwave recent floods in pakistan climate disinfo is blocked,1
995,i have just one single question for are the thousands of people who were displaced from floods adequately rehabilitated as he promised before cold winter kills them in inadequate camps pakistan deserves to know the answer to this most important question,0
966,i have never seen climate carnage on the scale of the floods here in pakistan this is a global crisis it demands a global response no time to wait actonclimate climateemergency climate energy renewables greennewdeal climateemergency cop,1
1104,i have never seen climate carnage on the scale of the floods here in pakistan this is a global crisis it demands a global response no time to wait actonclimate climateemergency climate energy renewables greennewdeal op https t co sskbubi hp,728
560,i keep telling laissez-faire relatives it s not gonna be degree stinkers it s gonna be degrees it s not gonna be floods where half the town lose their homes it s gonna be a third of the state submerged like pakistan and it ll probably happen within your lifetime,0
547,i look at the global warming with all the chen trails they literally took out of pakistan with the floods,3
409,i m assuming you were referring to the commonly spread line that flooding in pakistan was caused by deforestation affecting drainage which is false the point i was making is that if deforestation affected the floods in any way it was contributing to temp increases,0
339,i m borrowing this image from because i love the message and because the survivors of the pakistanfloods need all of us to step up and help right now please donate here and share if you possibly can thank you https t co jg gfwdxq https t co deen ndrlv,21
225,i remember that the man on the bbc who was talking like an expert but was actually a journalist when i googled him was explaining that the simultaneous drought in western europe and the floods in pakistan were both clear evidence of greenhouse gases with a straight face,2
57,i served my country with pride and honour for years i made a difference in the world saved homes from floods food to earthquake victims in haiti and pakistan and set a hospital for raped women in sudan what about you ever made a difference in anyone life canadianvets,1
1497,i want people to know that every aspect of pakistani society will feel the lasting effects of these floods amplify s voice by reading and passing on her account of the climate catastrophe devastating pakistan https t co eyjwqtjyew,10
230,i was thinking of amitav s talk at when a young lady in the audience said we all chant about climate change but we continue to covet electronic goods like iphones etc she nailed it most people don t care even in pakistan which faced floods it s not talked about,1
1020,i was working in pakistan during the floods the multinational company said they would match all the donations from local employees nobody donated why asked the md it just goes to corrupt politicians,1
838,i wrote about the floodsinpakistan for based on work in sindh fundraising with indusrelief as we collectively reflect on the outcomes of cop it s imp to ground our understanding in ppl s lived experiences longitudinal data https t co mncsx eg,10
59,if the previous floods of pakistan because of your ignorance in religion,0
58,if the previous floods of pakistan because of your ignorance in religion https t co jrvienbieq,0
1220,if you are talking about floods this video only tells the story of northern pakistan where the picture seems horrific and terrible whereas the situation down south in southern punjab per cent of sindh and the majority of baluchistan situation is still dire,0
611,imagine a country that is gripped by terrorism and a failing economy coupled with the devastation caused by the floods but is still obsessed with puritanical tendencies pakistan is hopeless beyond redemption https t co bspkqjtdwu,0
359,imagine being in flash floods caused by climate change like in pakistan as a pregnant woman or a woman who has just given birth or who has small children and trying to survive that and a man tells you we are all affected by the flood in the same way that there is no difference,0
1198,imagine living your life by some texts in an old book god cares about what women wear but cannot stops floods earthquakes cancer diseases born disabilities lol where was your god when thousands died in pakistan killing good muslims,3
532,imran khalid at the first session of nd annual conference at speaking on responding to climate crisis in pakistan glacial lake outburst floods drought heat waves dengue lotus attack reduces the resilience of people becomes serious sec threat fassconf https t co ers npyrzz,10
598,in continuation of humanitarian relief assistance for flood-affected people of pakistan distributed food items among affectees of flash floods in sibi balochistan prcs in collaboration with movement partners is making tireless efforts to help the flood affectees https t co fpjhndcuiv,8
1415,in her nd issue brief for intern mubina parveen writes about the floodsinpakistan link https t co jwxcqoafll https t co q jbtwdkfm,1
1157,in the wake of pakistan s devastating floods questions about flood resilience have been front and center for many working in the water energy food environment nexus read more from the cgiar initiative on nexus gains https t co ugfcui peh onecgiar,11
425,in there was massive floods in east pakistan when this drunken bum landed in dacca airport he was so drunk he wet his trousers he became butt of a joke the only thing he knew was women and getting drunk,24
1119,indeed a great achievement for pakistan coming from pm sharifs persistence in linking the floods with climate change as well as efforts of climate mister sherry rehman serious work should start now,2
1499,indeed you are correct mister rehman from pakistan was talking about the floods in bangladesh and my tired cop brain got confused,1
1185,india is the world s rd largest emitter of co after china us and india s ghg emissions are growing at the fastest rate as it adds more and more coal fired electricity generation https t co fnpa nx https t co hkinsiavcy,0
201,india never attacked pakistan the opposite happened and everyone knows the outcome jung kabhi jeeta nahi aur elections kabhi hareya nahi inshallah again it will be divided in pieces just like imran khan said allah is the best planner he planned floods for you,0
188,innovation at its best dtech i was just wondering if you could support communities affected by floods in pakistan with your house building technology a huge population has lost shelter as a result of massive floods in pakistan would love to see your interventions here,0
61,inspite of this aid money pakistan gets floods every year the aid money doesn t go to building infrastructure that could reduce or avoid floods,0
617,insurgency neglect hurt flood relief in pakistani province from https t co a cqc aq k,0
589,insurgency neglect hurt flood relief in pakistani province from https t co dnwzegr rs,0
556,international transfers fees rightly refunded for payments sent to ukraine but not for sending money to the millions displaced homeless starving from the devastating floods in pakistan do better lloyds,0
891,ironically now there is no dish left in pakistan crop failure locust and floods sad,15
73,islamic relief have already reached nearly women across pakistan but plan to step up the work to prevent gender-based violence by establishing safe spaces for women and children days https t co tdh pu uzx,5
1475,it s been an unprecedented tragedy speaks to pakistan s climate change mister following record floods that left of the country underwater https t co st sjomsn,40
112,it s going to be a massive fight next year the demand is for the hard-fought lossanddamagefund to be an operating entity of unfccc s financial mechanism making it obligatory with a system of replenishment s tells https t co bfcfrin ou,7
177,it s going to be a massive fight next year the demand is for the hard-fought lossanddamagefund to be an operating entity of unfccc s financial mechanism making it obligatory with a system of replenishment s tells https t co bfcfrin ou https t co ni budrzhp,3
208,it s going to be a massive fight next year the demand is for the hard-fought lossanddamagefund to be an operating entity of unfccc s financial mechanism making it obligatory with a system of replenishment s tells https t co bfcfrin ou https t co vnavyq hif,7
205,it s going to be a massive fight next year the demand is for the hard-fought lossanddamagefund to be an operating entity of unfccc s financial mechanism making it obligatory with a system of replenishment tells us cop https t co t twpd c https t co c q kfzu,2
901,it s heartbreaking to see thousands of people homeless due to severe floods in pakistan in sindh emergency response teams are conducting rapid field assessment of flood affectees in district larkan to provide them the humanitarian aid floodinpakistan https t co iwhpxahsoz,9
1006,it s terrible and so too are all the other videos from around the world pakistan s floods africa s droughts if the so called leaders of the latest meetings can t act now we are all doomed,0
878,it was an honour to have in balochistan where ir has started recovery efforts together we aim to scale up our efforts for the flood affected communities pakistanfloods rebuildandrestore https t co tva bgeyv,33
156,it was an ordinary evening ayesha shaikh recalls the night the devastating floods hit her hometown in pakistan she had never heard nor seen something so catastrophic by https t co lvvqd rvc,16
882,it wasn t been perfect but if you look up the word disaster it s far from it floods in pakistan now that is a disaster,0
389,kc cumulative damage floods in pakistan total deaths livestock house damage road damage km actonclimate climateemergency,0
123,kdf apna nhs pakistan flood appeal progress report bubar gilgit baltistan please donate generously online https t co cdh eb jdl to help people affected by floods rebuild their lives and livelihoods https t co zniaqopdcm,3
1363,key new report on pakistan floods international response high marks for on emergencytransfers but clear case for rethinking humanitarian response in fragile mics where space has shrunk local support modalities weak grants lackinghttps t co insohataos https t co lr vkhfobr,4
381,killa abdullah is a vulnerable district that was severely damaged by the pakistanfloods i had the opportunity to meet young students doctors and the community benefiting from the renovation of key infrastructure in a project of https t co xei sn ymo,42
372,killa abdullah is one of the many districts severely damaged by pakistanfloods on a mission to balochistan undpinpakistan rr met students doctors community benefitting from the renovation of key infrastructure by https t co wamzcnsvxx,14
35,kpzkci ukub i don t know the name of indian army chief and believe me minimum people of india will be like me but pakistan is different when of their nation facing difficulty due to unprecedented floods what is the main issue and what they discuss,0
320,latest kumail nanjiani a pakistani-american actor and comedian and sharmeen obaid-chinoy an award-winning director are launching charity bitcoin soul bound token nfts charity to help those affected by the dreadful floods in pakistan nftprojects nfts nftnews,1
1057,lies from a politician perhaps your voters know that https t co ao mhlzmbw one or floods in vancouver may have been worsened by man made climate change https t co dam uvcdno this year https t co c erjqio https t co jap ttnom https t co qg tfeudkc,1
1051,like the floods in pakistan every media outlet says they are once in years climate change they often have floods in pakistan a few years ago fires in australia would be out of control almost every year now they have switched to floods in australia climate hysteria https t co gylutrbuz,0
974,loss and damage fund s establishment by the un is a big win for pakistan as pakistan was hit by the devastating floods and rains dos to pakistani govt and foreign affairs mister for achieving this landmark in un,1
844,loss and damage funding is all well and good but it can only go so far writes https t co tgchfzac b,1
174,lossanddamagefund will only work if governments take responsibility for using it professionally in close cooperation with people who need it most important article by about the humanitarian governance challenge in pakistan https t co lkzgdfjl,5
0,m people displaced by floods in pakistan for a start the worst fires and hurricane damage recorded in the us catastrophic cyclones across asia worst floods ever in germany worst drought in europe ever last summer fires and floods in australia are you blind,0
576,make no mistake these floods are man-made so whom do we hold accountable whose collar do we grab to say our people are dying because of you https t co auyvp g v,4
9,makes sense as much as pakistan refusing indian aid and bangladeshi during the floods,0
33,many of the issues we encountered in pakistan were symptomatic of widespread and longstanding governance failures in the areas of gender equality and healthcare writes https t co hniaczc bh,6
466,many of the issues we encountered in pakistan were symptomatic of widespread and longstanding governance failures in the areas of gender equality and healthcare writes https t co hniaczcgqp,2
232,many of the issues we encountered in pakistan were symptomatic of widespread and longstanding governance failures in the areas of gender equality and healthcare writes https t co hniacztjsp,2
242,many people still need support in pakistan yet flood relief fundraisers are not getting the funding needed can you support this fundraiser organised by climatejustice pakistanfloods https t co ucpuyifztk,23
1244,mate your pakistan is so indebted to china you had to beg for an international bail out your former pm just survived an assassination attempt your countries poorest are devastated by floods your country has not even figured out how to function at the most basic level,2
671,maybe but turks make some of the most racist comments against south asians i saw some racist turks that were celebrating the floods in pakistan it had thousands of likes,0
1065,maybe if pakistan hadn t cut down over of their trees to make room for their over population increase over the last yrs they wouldn t have so much soil erosion which is the main reason for the devastating floods as there has been no significant increase in rainfall,0
1301,million people in the horn of africa are enduring climate-induced hunger crises pakistan faces billion in damage from the floods must step up to provide adequate funding to support the climate crisis during the final days of cop https t co w jpue ej,3
157,millions of children have been impacted by the floods in pakistan while hundreds have even lost their lives these children are the future of this world urgent action must be taken to ensure their nutrition and education,0
218,more than million children have had their education disrupted in the country says https t co trvlyvu s,1
1144,more than thousand schools have been damaged in pakistan due to monsoon floods peoplessindhgovt established tent schools so much grateful to sindhgovt for this step that can be a way to the enlightened empowered future of sindh childrensday https t co vxrmevl m,20
1458,ms shazia marri fed mister poverty alleviation social safety chairperson bisp briefed exe board at rome italy says that govt of pakistan through bisp has disbursed targeted cash relief amounting to million among million families hit by devastating floods https t co pobjf cyey,15
423,much better that s why petrol k laalay hain and default risk is at also jab imran global inflation kayhta thaa covid say woh haram thee but noonie mix achar expertise waalon kee record inflation daykhayn zaraa kya chaman chu log hain noonies https t co cfsrck xab,0
54,my colleagues at are doing everything possible to reach children affected by floods with direly needed assistance the risks on the ground continue to be high but moments like this give us renewed hope to keep going thanks for sharing https t co qcuvllonkt,29
335,my story regarding the situation during and after floods in pakistan is live on the website please read and share your comments with me https t co ppo lrreo,29
1055,nana no we should not pay any reparations at all pakistan was mentioned a nuclear power and they have cut down most of the trees which is why they have heavier floods,0
590,needs proper drainage system this area has been badly devastated four times by floods destroyed https t co jlqdgvrobx https t co kynyhtwogc https t co skhzd yrbr,1
581,needs proper drainage system this area has been badly devastated four times by floods destroyed https t co jlqdgw ptv https t co kynyhtfcrc https t co skhzd gpmr please help,1
243,new village under construction in pakistan for families that lost everything due to the floods your support is rebuilding lives https t co dopqrg g n https t co qbxrdc qhy,3
1086,newsupdates cop pakistan welcomes lossanddamage deal inked at summit pakustv nyc lossanddamagefund sharmelsheikh pakistanfloods climatecrisis egypt islamabad https t co k rhyzxp r,1
1269,next on twrnewsdesk pakistan s prime mister warns a debt trap if they continue spending their own resources on recovery following the devastating floods early this year from shares more from her time at cop tune in https t co ngtfkhqsuv https t co nhgjytwwnr,1
358,nick that woman who called in was rude and if its fact she wants then the floods in pakistan are recorded back to the th century without any human industrial cause how rude she was typical stop oil idiot,1
620,no but peer reviews are and when you are such an outlier such as this you have to stop and think am i wrong the answer is yes cherry picking data no deaths through floods really ask pakistan about that,1
754,no no pakistan is really talking about the floods i mean how else pakistan gonna get money for the floods also i mean there are tornados floods everywhere but pakistan needs the worlds money,0
44,no one addressed this aspect of human sufferings during recent floods in pakistan,1
1066,none,0
7,not sure that s completely true australia and pakistan had massive floods and china had a massive drought this year,2
1481,nov a report said that pakistan s gdp could decline because of climatechange by per year till water shortages heatwave and floods are likely to devastate agriculture sector mismanaged infrastructure urgent climateaction is needed friday https t co ezncyrihrk,1
69,nov ewe pakistan houses damaged in balochistan floods https t co ruijka pwi,0
68,nov ewe pakistan houses damaged in balochistan floods https t co ruijkaksyi,0
807,nov ewe pakistan rice exporters fear big drop in shipments after floods https t co v cd i fp,0
404,nov ewe pakistan rice exporters fear big drop in shipments after floods https t co v cd ig x,0
1459,now is partnering in pakistan because we re in this for the long haul rebuilding lives and livelihoods floods sindh https t co brrirwgmmz,17
1121,of pakistan floods every year this year bbc hyped it with bogus claims of then dropped the story for something more interesting the delta affected has no aid money spent and yet pakistan are a nuclear power c mon give em some more of our taxpayer s money,25
1479,of pakistan was not underwater in the recent floods even the bbc admitted their reports in this respect were wrong more disinformation and fear mongering,0
1229,off your go to china as i doubt there s a causal link between the industrial revolution and floods in pakistan today,0
217,ok so who did pakistan annoy that it is hit by rain floods earthquakes and locust swarms,23
309,okay then what happens like right now when the world has mopped up most of the maize food since there s drought in ea europe north america add war in ukraine sanctions on russia mega floods in pakistan etc,0
36,on pillars and let people of pakistan suffer and enjoy with poverty floods etc because this will speed up of accountability of common man that what is the reason that you are poor and what is the reasons that now a days children s rape murder ratio increased,1
245,on saturday at kingsbridge climate action have organised a fundraiser for pakistan flood relief follow the link on our website for full details and booking https t co dtidjsi x climateaction climateemergency pakistanfloods https t co ryikqtsmaq,1
1500,on the recent floods pakistan s federal mister for climate change warned what went on in pakistan will not stay in pakistan that dystopia that came to our doorstep will come to everyone cop cop egypt https t co vk elophwt,8
917,on the st day of her visit to pakistan ms met with wilbroad ngambi chief field office in punjab they exchanged on the partnership to deploy national un volunteers to support response efforts to the recent floods https t co iizolyi https t co tpjfebrl h,3
869,on worldchildrensday we asked children to share what they would do for themselves and their communities if they were prime mister of pakistan here are responses collected from children from a long-term settlement next to hyderabad affected by the floods https t co vajydgtqsk,5
531,one thing is for sure as a nation we need a diet change and rice prices are rising due to recent floods in pakistan australia hard to use wheat on densely populated boarding schools,3
725,org the devastating floods in pakistan show why climate finance is needed now the promised billion is two years behind schedule people are suffering when will you be stepping up https t co b h ycgec,0
569,org the devastating floods in pakistan show why climate finance is needed now the promised billion is two years behind schedule people are suffering when will you be stepping up https t co eeafpvspcr,0
1236,org the devastating floods in pakistan show why climate finance is needed now the promised billion is two years behind schedule people are suffering when will you be stepping up https t co ent gijaar,0
1287,org the devastating floods in pakistan show why climate finance is needed now the promised billion is two years behind schedule people are suffering when will you be stepping up https t co g scrxktfk,0
52,org the devastating floods in pakistan show why climate finance is needed now the promised billion is two years behind schedule people are suffering when will you be stepping up https t co hlxasyq,0
1294,org the devastating floods in pakistan show why climate finance is needed now the promised billion is two years behind schedule people are suffering when will you be stepping up https t co kvzq ua,0
407,org the devastating floods in pakistan show why climate finance is needed now the promised billion is two years behind schedule people are suffering when will you be stepping up https t co mmjdrgp y,2
226,org the devastating floods in pakistan show why climate finance is needed now the promised billion is two years behind schedule people are suffering when will you be stepping up https t co pnhexo xdf,0
567,org the devastating floods in pakistan show why climate finance is needed now the promised billion is two years behind schedule people are suffering when will you be stepping up https t co w sjyn fvv,0
43,org the devastating floods in pakistan show why climate finance is needed now the promised billion is two years behind schedule people are suffering when will you be stepping up https t co zrywlxqozt,0
677,our team met the representatives of punjab irrigation dept to discuss ongoing activities as part of wrap program component crs-iwag the iwmi team suggested various approaches for effective water management in mitigating floods https t co lbuuqg roj,17
