,CLEAN_tweets,likes
608,disaster aid uk ireland are still working in conjunction with our overseas partners to provide aid to those suffering as a result of the floods in pakistan to donate find out more please follow this link https t co vqd p l h https t co nwj cxjmic,2
526,disasters due to climate change have domino effect e g in pakistan floods have destroyed crops eventually food disaster threat dr imran saqib in fassconf https t co kixahjhjhr,10
601,dm rgan schools i ve just put together a nice wee task for th form pupils using remote sensed data from other gis resources to explore the nature and impacts of the floods in pakistan if that s any use to you https t co y l cucy,7
240,do u know what afghanistan is pakistan is worse than that their army chief retired this month with billions of dollars in bank of country under water coz of floods of pak is baluchistan ind country s illegally occupied indian territory what remains,0
1399,do you want to go down in history as the person representing the country that blocked a degree declaration it s abhorrent are the stories from pakistan barbados maldives not enough the floods and storms in canada,1
990,don t forget he s also responsible for the war in ukraine the floods in pakistan the fires in california the hurricanes inflation and the nail i got in my tire last week,1
1183,don t miss founder of on the ourhenhouse podcast he joins co-hosts and to discuss the disaster relief work he s spearheading for humans and animals following the pakistan floods listen to ep https t co ff az dqhh https t co el otdo fl,3
1184,don t miss founder of on the ourhenhouse podcast he joins co-hosts and to discuss the disaster relief work he s spearheading for humans and animals following the pakistan floods listen to ep https t co n p vgt https t co vtlx lr ek,1
1200,don t miss founder of on the ourhenhouse podcast he joins co-hosts and to discuss the disaster relief work he s spearheading for humans and animals following the pakistan floods listen to ep https t co wlfv qtosh https t co pgxz qfy,5
1318,dpc pcu pgdp ms ahad khan was invited to meet senior diplomats of uk to discuss current scenario of climate change floods water management in country they also discussed opportunities for uk in building pak s resilience https t co tqclwk aty,3
1413,dr kiran hassan write an amazing piece for titled as where did the media go wrong with reporting on floods in pakistan https t co xnvqdseeuu,9
382,due to severe damage caused to the rice crop by the floods in sindh rice exports are expected to decline by this year resulting in pakistan losing over million in foreign exchange https t co mnge gc,0
639,during the interaction coas said the business community has always helped people of pakistan during various natural calamities including their support in recent floods,1
728,during the recent floods in pakistan it was heart-breaking to see a mother of young children and a th on the way crouched on a muddy bank no clean drinking water no food no shelter exposed to the elements it is not racist eugenics to speak up for womens rights,1
773,earlier this year pakistan was struck by devastating monsoon floods that left nearly a third of the country under water affecting more than million people bbzleadingclimatejustice aliali,12
1032,earlier this year pakistan was struck by devastating monsoon floods that left nearly a third of the country under water affecting more than million people bbzleadingclimatejustice https t co dwoesvmxcz,7
983,earlier this year pakistan was struck by devastating monsoon floods that left nearly a third of the country under water affecting more than million people bbzleadingclimatejustice https t co ebhvef tc,1
1015,earlier this year pakistan was struck by devastating monsoon floods that left nearly a third of the country under water affecting more than million people bbzleadingclimatejustice https t co f xh cuhqx,0
1011,earlier this year pakistan was struck by devastating monsoon floods that left nearly a third of the country under water affecting more than million people bbzleadingclimatejustice https t co pir geknjm,0
435,economist jeffrey sachs describes an economists method to calculate fair compensation to pakistan for the loss and damage it experienced of the floods sachs is professor at columbia and president of the un sustainable development solutions network https t co dzijujid,0
128,eeeks complete slamic takeover of fiji underway backed by slamic pakistan literally drowning in floods while hindu majority india with its muscular economy informed diaspora indigenous aircraft carrier is apathetic to plight of fijian hindus https t co takomwjage https t co ojhguvkko,2
200,emergency response teams continue to provide support to people affected by the recent floods that hit the country recently pakistan red crescent teams https t co letplqsqiz,11
1386,emergingbalochistan providing services to pregnant lactating woman affected by pakistan floods in sohbatpur balochistan https t co q h hgp ky,2
655,essay pakistan floods ancient grains like millet could be key to rebuilding food systems foodsecurity pseudograins millet grains https t co uxucmtagv,0
1154,estimates more than million childrens education has been interrupted due to the floods in pakistan the longer schools remain closed the greater the risk of children dropping out altogether increasing their likelihood of being exploited and abused pakistan https t co w gn vmdsp,2
993,et day locked out of work accounts fix it https t co gkuamkvkvo pakistanfloods millions homeless facing starvation save a life https t co bu oqoopor pakistan khabib pennyappealcanada,1
1060,even worse back in at feet all i could see was a lake extending to the horizon only here and there a few treetops jutted out of the water it looked just like a sea https t co hpnn siklc,1
918,every few yrs floods in pakistan do you thing it could be due to water of mountains and also government not bothering about doing anything about rivers,0
241,exactly for example the pakistan floods are an apt example of the cost it had to bear what are your thoughts on greenmobility,0
181,excited to announce that the saf flood relief dvc has been nominated for the once again scan the qr code and vote for saf to help us spread the message of hopenotout for all vote https t co cmcatuyyvu https t co ct fwju kz,40
577,exec director spoke to s about the uk s responsibility to compensate countries such as pakistan who experienced devastating floods earlier this year cop lossanddamage climatefinance compensation https t co b xqnhzgpq,1
1476,fact check bullsocks https t co panqcpf d https t co ptvmr qqhq,0
1391,federal mister for poverty alleviation social safety shazia marri meets un s dg mr qu dongyu at rome italy briefed him food-agro issues caused by devastating floods in pakistan she briefed them benazirincomesupport program contribution to help affectees in timely manner https t co bpdm eave,0
1132,floods and drought we have never seen before is this gobshie for real pakistan has had floods and droughts for thousands of years thousands as has europe absolute dogs bossex,1
835,floods have been occurring in pakistan since the s due to monsoon season natural and cyclical no amount of money is going to change what mother nature does,0
484,floods have devastated balochistan yet it doesn t seem like the pakistani government is concerned the government of pakistan should be compelled to provide assistance by international organisations balochistanfloods balochgenocide https t co daketuooq,0
199,floods have devastated balochistan yet it doesn t seem like the pakistani government is concerned the government of pakistan should be compelled to provide assistance by international organisations balochistanfloods balochgenocide https t co ev iagsvm,0
421,floods have devastated balochistan yet it doesn t seem like the pakistani government is concerned the government of pakistan should be compelled to provide assistance by international organisations balochistanfloods balochgenocide https t co jh v zhh,0
439,floods have devastated balochistan yet it doesn t seem like the pakistani government is concerned the government of pakistan should be compelled to provide assistance by international organisations balochistanfloods balochgenocide https t co lool noqal,0
449,floods have devastated balochistan yet it doesn t seem like the pakistani government is concerned the government of pakistan should be compelled to provide assistance by international organisations balochistanfloods balochgenocide https t co omwrbpnmvz,0
343,floods have devastated balochistan yet it doesn t seem like the pakistani government is concerned the government of pakistan should be compelled to provide assistance by international organisations balochistanfloods balochgenocide https t co penempyfqm,0
473,floods have devastated balochistan yet it doesn t seem like the pakistani government is concerned the government of pakistan should be compelled to provide assistance by international organisations balochistanfloods balochgenocide https t co prfaqxgngm,0
192,floods have devastated balochistan yet it doesn t seem like the pakistani government is concerned the government of pakistan should be compelled to provide assistance by international organisations balochistanfloods balochgenocide https t co qsvhoan bp,0
461,floods have devastated balochistan yet it doesn t seem like the pakistani government is concerned the government of pakistan should be compelled to provide assistance by international organisations balochistanfloods balochgenocide https t co rblhv qen,0
418,floods have devastated balochistan yet it doesn t seem like the pakistani government is concerned the government of pakistan should be compelled to provide assistance by international organisations balochistanfloods balochgenocide https t co tgnu ab tz,0
203,floods have devastated balochistan yet it doesn t seem like the pakistani government is concerned the government of pakistan should be compelled to provide assistance by international organisations balochistanfloods balochgenocide https t co ygnyorw qw,0
479,floods have devastated balochistan yet it doesn t seem like the pakistani government is concerned the government of pakistan should be compelled to provide assistance by international organisations balochistanfloods balochgenocide https t co yk vmrni f,0
355,floods have devastated balochistan yet it doesn t seem like the pakistani government is concerned the government of pakistan should be compelled to provide assistance by international organisations balochistanfloods balochgenocide https t co zvkapobvtp,0
1455,floods have particularly impacted the poorest most vulnerable districts in pakistan undpinpakistan are partnering to create income opportunities for flood-affected families in sindh morehttps t co turvjf qzn pakistanfloods resilientpakistan https t co ygcin oimk,20
351,floods have wreaked havoc in balochistan driving many people both young and old from their homes the rulers in pakistan are arrogant as seen by their lack of compassion for the flood victims balochistanfloods balochgenocide balochistan https t co xwmxirxg u,0
482,floods have wreaked havoc in balochistan driving many people both young and old from their homes the rulers in pakistan are arrogant as seen by their lack of compassion for the flood victims balochistanfloods balochgenocide https t co d erfcg k,0
419,floods have wreaked havoc in balochistan driving many people both young and old from their homes the rulers in pakistan are arrogant as seen by their lack of compassion for the flood victims balochistanfloods balochgenocide https t co dz u xxo,0
414,floods have wreaked havoc in balochistan driving many people both young and old from their homes the rulers in pakistan are arrogant as seen by their lack of compassion for the flood victims balochistanfloods balochgenocide https t co jl d lzolt,0
341,floods have wreaked havoc in balochistan driving many people both young and old from their homes the rulers in pakistan are arrogant as seen by their lack of compassion for the flood victims balochistanfloods balochgenocide https t co qsi gfr ui,0
477,floods have wreaked havoc in balochistan driving many people both young and old from their homes the rulers in pakistan are arrogant as seen by their lack of compassion for the flood victims balochistanfloods balochgenocide https t co z kjicgrx,0
334,floods in pakistan access to education water restored in swat valley thanks to specialists from have repaired schools suspension bridges water distribution systems press releasehttps t co dihmk qiy pakistanfloods https t co dy mcyiy x,35
1368,floods in pakistan have been happening for at least the last years and their government has done nothing about it pakistan never had an industrial revolution,0
988,floods in pakistan have no effect in north america don t care,0
883,floods in pakistan in there were million people and it was covered by trees over those years deforestation has taken place and they re now over million people so when it rains it floods no trees to stop it why should we compensate them for their actions,1
1246,floods in pakistan produced megabucks of aid none of which got as far as buying flood defence source wiki not just me rancid corruption don t waste your money,2
172,floods in pakistan the swiss agency for development and cooperation helped the swat valley get access to water education with the collaboration of https t co sv kl tkt,0
1262,floods in scotland and pakistan do fck all not really news but the facts are never reported by the racist dictatorship bbcbreakfast https t co g uurljilo,0
1271,floods in scotland so is every bank tv station media outlet and pakistan having a whip around no so fck off with your racism bbcbreakfast,1
1253,floods in uk are often caused by having built on the flood plain and by having concreted over the soil in pakistan it is due to excessive rainfall climate crisis is a political myth,0
1118,for someone who has seen his home disappear in the floods in pakistan a solar panel or a sea wall isn t much use explained from the climate action network emissions peaking before as the science tells us is necessary not in this text,1
1142,from somalia to pakistan from drought to floods climatecrisis is hitting us hard the lossanddamagefund lobbied by g is the only positive outcome despite its focus on implementation the world will wait for cop to include fossilfuels phaseout https t co vmqt ryv,14
1090,funny how trisha goddard on is talking about absolute truths after allowing her previous guest to repeat unchallenged the already debunked line about a third of pakistan being flooded https t co zssdlebwa,2
234,get to know better and learn more about our story https t co sj sfcg be sure to donate and help us support emergency responses around the world https t co umza prefq pennyappealcanada nonprofit emergencyresponse pakistanfloods nigeriafloods,1
742,getting the initial buy-in from the polluters of the first world is a phenomenal foundation stone using which pakistan a developing country battered by the unrelenting onslaught of biblical floods would stand on its own feet bbzleadingclimatejustice https t co eesrkngt v,7
1135,given the floods the debt is bound to increase as a result the already ramshackle development will further suffer shortage of fuel will expound nation s problem despite all this there s no political consensus to drag pakistan out of this mess https t co bsuu odr,0
1473,glad to share kfw s support to pakistan s devastating floods on behalf of strongertogether teameurope https t co opoqizv gg,14
551,go live in pakistan for a while and experience the floods then tell me it s not incredibly important,2
1426,good luck football club thank you for helping unhcr relief efforts so many people still in great need in the aftermath of the pakistan floods https t co lviydtzfat,1
1432,good luck to football club on their first-ever charity match against british airways to support families affected by the pakistan floods through charity partners including uk for unhcr https t co kwq czgop,3
1219,good move loss afghanistan india raw lost leverage in pak afghanistan conditions with funds freezes could turn fertile ground terrorist in future even floods in pakistan taiwan aims india dispute lac china can push pak afghans to terrorism for containing india,0
247,great perspective by the great ancient grains like millet could be key to rebuilding food systems https t co udejyli p,8
1325,guess you didn t hear about those floods in pakistan or that some island nations will be completely underwater you might not like it but it s a fact https t co v x gfc h,0
1117,guest on lbc suggests deforestation may have contributed to the extent of the pakistan floods gets called climate change denier by,1
206,guided by the needs on the ground is working with communities to support recovery from pakistanfloods on a mission to balochistan undpinpakistan rr met students doctors community benefitting from the renovation of key infrastructure https t co iq mxfvjvk,54
138,h e ambassador of the met with the deputy commissioner kalat mr muneer durrani dc kalat spoke about the devastation caused by recent floods how people are unequipped for the upcoming harsh winter he also suggested the expansion of https t co p tqnop pn,35
1179,hahahahaha burned pakistan to the ground that s funny you think he did that in years but completely ignore what s happened in the last the people you re vouching for couldn t even build a single dam then they wait for floods to go out and start begging gimme a break,1
49,happeningnow role of police in addressing gender based violence cases during floods in pakistan at today shahla qureshi https t co rhb aflowf,15
797,hard to choose iran ukraine war famine in yen syria and many other countries pakistan floods deadly religious persecution around the world myanmar and other conflicts to name a few,0
674,harvey repeated the debunked untruth that of pakistan had been inundated as a result of recent monsoon floods the actual figure in this mountainous country was easily checked from nasa data and was about,0
104,hasnain team deserve special appreciation doing great job covering longmarch ma be it the heat of summers rain floods now cold winter nights they tirelessly shared minutely visuals common man s views serving literally as voice of,0
597,hav u seen his work during floods in pakistan yes he is different from the rest of his family he s sympathetic towards people that s all that counts,0
1010,have a look at this then lookup kiribati rising sea level they have bought land in new zealand to evacuate their entire population to they emit practically nothing and are extremely poor then lookup bangladesh m live about m above sea level https t co i hwwuu bb,0
971,having experienced first-hand the scale and devastation of pakistan floods they travelled to the united nations general assembly to advocate for climate justice fm appnews https t co rcajy xh i,0
1091,having experienced first-hand the scale and devastation of pakistan s floods we travelled to the united nations general assembly to advocate for climate justice fm said in a series of tweets bbzleadingclimatejustice https t co hj wr uh u,5
1103,having experienced first-hand the scale and devastation of pakistan s floods we travelled to the united nations general assembly to advocate for climate justice fm said in a series of tweets bbzleadingclimatejustice https t co khchx gezo,48
1105,having experienced first-hand the scale and devastation of pakistan s floods we travelled to the united nations general assembly to advocate for climate justice fm said in a series of tweets bbzleadingclimatejustice https t co vyzqmbqbff,26
1036,having experienced first-hand the scale and devastation of pakistan s floods we travelled to the united nations general assembly to advocate for climate justice said in a series of tweets bbzleadingclimatejustice https t co fy ulow r,3
1352,he did pakistan floods remember,0
497,he is from pakistan i take every opportunity to remind pakitweeterstan that allah is punishing their country with devastating floods because of the coutry s virulent antisemitism keep claiming allah is punishing them collectively as they blaspheme his name when they lie,0
892,heads the g group is a coalition of developing countries and has been using this global leadership role to raise awareness for the catastrophic floods in pakistan and for global warming in the world https t co tppdq zulf,51
1241,heartwarming to see this work going on the floods are devastating with so little msm coverage as to the ongoing misery for millions pakistan,1
332,hello brother i hope you would be fine and happy i live in pakistan and bong to a poor family a few months ago floods came into our village and since then we were living a miserable life a friend told me about crypto and how it can make my family s lives better https t co jw zjf qs,0
1506,helps pakistan children during devastating floods effecting millions https t co yzxospkrkk,0
958,here is my recent metaphorical and expressionistic portrait of angelina jolie on her recent visit to pakistan to show solidarity with the severely affected people s with torrential rain and horrible floods due to the climatic change of our ailing planet https t co nn mkn eb,0
961,here is my recent metaphorical and expressionistic portrait of angelina jolie on her visit to pakistan on the behalf of un to show her solidarity with the severely affected people s of pakistan due to torrential rain and horrible floods in https t co ykxoqtir a,0
136,here s the view from this morning s green and white assembly to raise awareness of the floods in pakistan our friends and inspired us worship if you can please donate via one of the official uk fundraisers online https t co fjtj d xa,1
23,heresy devastating floods in pakistan galvanized support for a u n fund to help countries harmed by climate change but scientists say it s hard to link single weather events to human-induced global warming https t co xkdlpgcotd via,0
980,highly admire and appreciate the pak leadership who are never short of brilliant ideas to beg alms from big donors worldwide waronterror and climatejustice cop katora bhikhari jihad https t co viyqo erm,1
881,hindu girl gang raped by khalid and dilsher on the pretext of providing food amid devastating floods in sindh pakistan she said that the accused auto rickshaw driver duped her and said that he would provide grocery items,0
1223,history knows those floods in pakistan have been going on forever there is no climate crisis facts are facts your post is deliberate misinformation https t co hzcsut cg,1
1424,honoured to have been invited to by representing to discuss pakistan floods the response recovery rehabilitation still so much to be done lots of support required thanks for covering https t co qal htxju,51
1418,hospital officials said eight women and children ages to were among the dead https t co f p apse l,0
3,how come floods affected pakistan economy i never understood,0
1298,how come they ve had floods in pakistan for as long as i remember some should check the record books before we start writing cheques,0
327,how dare you agree to give our money away like this with no consultation manifesto it ll all be wasted whilst we go in hock https t co dejiq nmm consequential deforestation causes floods https t co emqief h,1
1372,how do floods in pakistan affect them when most of them live here,0
465,how do you avoid getting sick when you re homeless sleeping in a cloud of malaria-carrying mosquitoes and with no clean water to drink muhammed received a hygiene kit from dec charity in pakistan to help keep his family safe in the aftermath of the pakistanfloods https t co bd qxfwces,2
1382,how do you avoid getting sick when you re homeless sleeping in a cloud of malaria-carrying mosquitoes and with no clean water to drink muhammed received a hygiene kit from dec charity in pakistan to help keep his family safe in the aftermath of the pakistanfloods https t co dxen fwds,1
1383,how do you avoid getting sick when you re homeless sleeping in a cloud of malaria-carrying mosquitoes and with no clean water to drink muhammed received a hygiene kit from dec charity in pakistan to help keep his family safe in the aftermath of the pakistanfloods https t co eotq sok,3
422,how do you explain the causal relationship between co emissions and temperature increase also the pakistan deforestation is a myth flash floods were caused by dry soil after an unusually hot season fuelled in fact by deforestation which releases tonnes of carbon,0
911,how far has pakistan s flood response capacity improved since the floods tabadlab takes a closer look at the lessons learned from the floods and analyses how well prepared the ndma was for the calamity https t co hrv x k co-authored by,0
1087,how many trees have they chopped down then shock when the land floods https t co uejpq cbin,7
102,how much did bollywood donate for assamfloods biharfloods or any other natural calamity in india nil but they donted in pakistan floods earthquake time for boycottbollywoodcompletely,2
853,how much should uk pay for flooding in pakistan that you cannot prove has anything to do with climate change and still less that uk is responsible for it pakistan has floods ever year and always has,1
554,how r the floods in pakistan,0
1395,huge thank you to everyone at south hampstead high school for raising funds for the pakistan floods appeal donations to the appeal are helping families who have lost their homes and livelihoods survive the difficult months ahead,1
